{"build_context_digest":"sha256:53f37fafc2fef91f2e933414178dd4362309a6e5ac1c401de146682e62b3f058","engine":{"arch":"amd64","binhost_path":"/binpkgs/releases/amd64/binpackages/23.0/x86-64_volatoo-systemd-base-v1","image_digest":"sha256:3333333333333333333333333333333333333333333333333333333333333333","mirror_bundle_digest":"sha256:4444444444444444444444444444444444444444444444444444444444444444","profile_id":"volatoo/amd64/glibc/systemd/23.0/base-v1","repository_ids":["gentoo","volatoo-overlay"],"repository_names":["gentoo","volatoo-overlay"],"required_features":["binpkg-multi-instance","sandbox","userpriv"],"resource_class":"medium"},"schema":"org.volatoo.portage-engine-target/v1","target_id":"volatoo/amd64/glibc/systemd/23.0/base-v1"}
