{"build_context_digest":"sha256:fc45b271c47ab407c175451264f0847eb889d1720824edd9932d36ff6ac9bc25","engine":{"arch":"amd64","binhost_path":"/binpkgs/volatoo/amd64/glibc/openrc/23.0/base-v1","image_digest":"sha256:1111111111111111111111111111111111111111111111111111111111111111","mirror_bundle_digest":"sha256:2222222222222222222222222222222222222222222222222222222222222222","profile_id":"volatoo/amd64/glibc/openrc/23.0/base-v1","repository_ids":["gentoo","volatoo-overlay"],"repository_names":["gentoo","volatoo-overlay"],"required_features":["binpkg-multi-instance","sandbox","userpriv"],"resource_class":"medium"},"schema":"org.volatoo.portage-engine-target/v1","target_id":"volatoo/amd64/glibc/openrc/23.0/base-v1"}
